<?xml version="1.0" encoding="UTF-8" standalone="no"?>
<epp xmlns="urn:iana:xml:ns:epp-1.0"
     xmlns:xsi="http://www.w3.org/2001/XMLSchema-instance"
     xsi:schemaLocation="urn:iana:xml:ns:epp-1.0 epp-1.0.xsd">
  <response>
    <result code="1300">
      <msg>Command completed successfully; no messages</msg>
    </result>
    <unspec/>
    <trID>
      <clTRID>ABC-12345</clTRID>
      <svTRID>54321-XYZ</svTRID>
    </trID>
  </response>
</epp>