<?xml version="1.0" encoding="UTF-8" standalone="no"?>
<epp xmlns="urn:iana:xml:ns:epp-1.0"
     xmlns:xsi="http://www.w3.org/2001/XMLSchema-instance"
     xsi:schemaLocation="urn:iana:xml:ns:epp-1.0 epp-1.0.xsd">
  <command>
    <transfer op="request">
      <contact:transfer xmlns:contact="urn:iana:xml:ns:contact-1.0"
       xsi:schemaLocation="urn:iana:xml:ns:contact-1.0
       contact-1.0.xsd">
        <contact:id>sh8013</contact:id>
        <contact:authInfo type="pw">2fooBAR</contact:authInfo>
      </contact:transfer>
    </transfer>
    <unspec/>
    <clTRID>ABC-12346</clTRID>
  </command>
</epp>