<?xml version="1.0" encoding="UTF-8" standalone="no"?>
<epp xmlns="urn:iana:xml:ns:epp-1.0"
     xmlns:xsi="http://www.w3.org/2001/XMLSchema-instance"
     xsi:schemaLocation="urn:iana:xml:ns:epp-1.0 epp-1.0.xsd">
  <response>
    <result code="1301">
      <msg id="12346">Credit balance low.</msg>
    </result>
    <msgQ count="4">
      <qDate>2000-06-08T22:10:00.0Z</qDate>
    </msgQ>
    <unspec/>
    <trID>
      <clTRID>ABC-12345</clTRID>
      <svTRID>54321-XYZ</svTRID>
    </trID>
  </response>
</epp>